content,rating
"평가단리뷰입니다!
일단 제 피부는 민감성에 건조한 피부입니다.
사용전에 턱이랑 이마쪽에 뾰루지랑 여드름이 울긋불긋하게 올라와서 이 부분을 보면 확실히 개선 여부를 확인할수 있겠거니 싶어서 받은 직후부터 방금까지 발라보았습니다.
평소 쓰던 토너와 이 로션을 위주로 발랐고 이것만으로 건조함이 느껴질 때에는 아이크림이나 판테놀 크림을 덧발라 사용했어요.

1. 향이 너무 강하다.
제가 민감성이라 합성의 무언가들을 기피하는 편입니다. 원래 쓰던 화장품들이 다들 무향이라 그런지 이 제품의 향이 지나치게 강하게 느껴져 좀 거부감이 들었어요. 향 자체는 나쁘지는 않았지만 너무 쎈 느낌.

2. 트러블에 직접적인 효과는 없는 것 같다.
턱과 이마주변에 난 트러블에 자꾸 상처가 나서 그런지 이 친구들은 일단 아물생각이 없어보입니다. 하지만 상처 나지 않은 트러블에도 자연적인 치유 이상으로 빠른 케어 효과는 나타나지 않았어요. 트러블 흉터는 원래 생겨도 금방 사라지는 편이라 잘 모르겠네요.

3. 피부 결 개선은 조금 된것같다.
트러블에만 집중했을때는 에이 뭐야 이거 별로 효과 없네 했는데.. 다들 그런거 있지 않나요? 세수하고 로션 다 바르고나서 거울을 보며 내 피부와 얼굴을 관찰하는 시간(...?) 어느날 보니 피부 결이 살짝 매끈해진 느낌이 들었어요. 원래 좁쌀까진 아닌데 피부 겉에 미묘하게 우둘투둘(?)한 것 들이 이마주변에 있었는데 이것들이 눈에 덜 띄기 시작했어요.

4. 건성은 겨울에 단독 사용 못할 듯.
여름이라 괜찮겠거니 하고 토너 이후로 단독 사용해봤는데 몇번 당김을 느꼈어요. 처음엔 덧발라 사용해보려고 했는데 덧 바르니 때처럼 밀림 현상이 있더라구요. 습한 날씨인데도 불구하고 제형이 바를땐 촉촉한듯하나 바르고 나면 곧바로 스며드는(?증발하는?) 느낌이라 제 피부가 필요한 만큼의 보습 기능은 안됬던것 같아요.


+
끝으로 정리하자면 
향이 제 취향이 아니고 건조한 나에겐 조금 부족한 에멀젼 이지만 피부 결 개선 효과는 좀 본 것 같아서 일단 제품이 있으니 올 여름은 쭉 써도 괜찮을 듯 싶어요. 하지만 재구매는 좀 힘들 것 같고, 저 같이 여름에도 건조함을 어느정도 느끼는 건성 분들에게는 다른 더 보습감이 있는 제품을 쓰시는게 좋을 것 같아요!
이 제품은 건성보다는 지성 피부에게 더 맞을듯!",3
"평가단 당첨떠서 써보게 된 에멀젼 ~~
트러블 케어를 한다구 스킨바르고 얼굴전체에 
발라주는 방법으로 쓰는 에멀젼인데요 
그때 딱 타이밍 좋게 얼굴에 뾰루지가 산더미로 나있던때라 ,,, 개이득하면서 썼는데 일단 발림성은 저는 좋았어요 끈적거리지도암ㅎ고 얇게 착 밀착이 된 기분...? 생각보다 얇게 발려져서 저는 좋았어요 
로션이란게 좀 꾸덕하고 끈적하다는 그런생각이 박혀있어성 ㅎㅎ ;; 근데 제가 꾸준히 쓰기는 했는데요 뾰루지가 싹 다 없어졌긴했어요 ... 이게 이 제품 때문인지 잘 관리를 해서인지는 모르겠는ㄷ 아마 제품 때문이겠젼 ?? 자주 쓸것같아영 끈적이지도않고 얇게 바로 밀착이 ㅁ따구되부리니깐 저는 만족스러웠습니당  진짜 끈적임이 없는건 최고 ..........",4
"평가단으로 받게 되서 일주일정도 꾸준하게 사용했어요!!
일단 저는 수분부족형 지성 피부구요 모공이랑 블랙헤드 정말 심한게 고민이었어요
이거 받을 즈음에는 얼굴에 트러블때문에 붉어지고 모공 늘어나고 난리가 났었던 상태였었어요.. 피지두 대박 심햇엇고ㅠ
일단 제형은 로션인데 부드럽게 잘 발리는 타입이에용~
단독으로 쓰기에 수분감이 조금 부족한 편인데 여름이고 저는 지성이기 때문에 듬뿍듬뿍 발랐더니 괜찮았어용
건성분들이나 겨울에는 단독으로 쓰기엔 무리일 것 같아요 ㅜㅜ!
세수하고 스킨 바르고 이거 듬뿍듬뿍 올려주고 잤는데 일주일 사이에 피부가 진짜 많이 호전됏어요!!
피지도 진짜 많이 들어갔고요 블랙헤드도 엄청 옅어졌어요ㅠㅠ
코랑 볼쪽에 트러블 난 것도 다음날 바로 들어갔구요!
저는 즉각적으로 효과를 봐서 재구매 의사도 있습니당!
용량이 좀 적어서 금세 쓸 것 같아용 ㅠㅠ",5
"평가단리뷰
당첨된 다음날 바로 배송받아서 지금까지 쭉 사용해봤습니다
(저는 얼굴에 트러블없는 수부지타입이고 동생은 트러블많은 지성입니다)
일단 베이비파우더냄새가 나서 순한제품인데도 약간 두려움이 있었는데요 음,,, 향료를 굳이 넣지않았어도될거같아요! 역한냄새라거나 그런건아닙니다
겨울에 이 제품으로 마무기하기엔 건조할거같지만 여름에 수부지/지성피부가 마무리하기엔 땡기거나 그러진않았어요!

아벤느 미스트랑 sos크림써본적있는데 역시나 이제품도 피부가 편안하다는 느낌을 받았어요! 이미 나있는 트러블까지 단기간에 사라지게해주진않지만 자극받은 피부나 붉은기가 올라와서 예민한피부일때 저녁에 스킨-알로에수딩젤->다음에 이제품 발라주면 확실히 다음날 피부가진정됐습니다
그리고 이마나 코주변,쇄골쪽에 뭐가 날듯이 간질간질하거나 살짝올라왔을땐 연고처럼 약간두껍게 올려주면 다음날 줄어들어있었어요!

단점이 있다면 ㅜㅜㅜ 용량이 40ml라서 이미 절반은쓴거같아요..,,☆
여자 두명이서 하루에 2번정도씩 쓰니까 2주도안돼서 제품이 가벼워졌어용ㅋㅋㅋ ㅠㅠ근데 제품에 만족해서 다 쓰면 집에 데일리용은아니더라도 예민할때 사용하게 구매해두려구요 올리브영에서 19000원대에 세일하더라구요!

드라마틱한 효과는 너무 기대하지마세요 
하지만 좋은피부상태를 유지시키는데에는 진짜좋은제품인거같아요!",5
"스킨케어 제품이라 7일 넘게 써보고 리뷰올림

1. 발림성
발림성 진짜 좋음 부드러운 로션 제형인데 펴바르기도 쉽고 펴바르면 살짝 수분감 넘치게 변하면서 촉촉함
크림 나오는부분이 좁게 되어있는데 답답한정도가 아니고 딱 양조절하기 편한 정도임

2. 추천하는 피부형(중성이나 지성)
참고로 나는 중성임! 원래 스킨 앰플 크림을 바르는데 크림 대신 이걸 발랐더니 건조해서 나중에 화장할때 파우더 바르니깐 떴었음ㅠ 근데 스킨 앰플 클리낭스에멀젼 수분크림 이렇게 바르니깐 진짜 유분기는 잡아주면서 세상 촉촉하게 마무리되고 수분감 지속력도 좋았음ㅠㅠ
짱짱을 준 결정적인 이유가 피지를 잡아주는데 신기하게도 피지잡아주는 제품인거에 비해 진짜 촉촉함
그리고 피지를 잡아주다보니 설명에도 있듯이 모공쳐짐도 잡아줌
결론은 요즘 날씨에 중성이면 수분크림과 곁들이면 딱 좋고 지성분들은 클리낭스 에멀젼으로 끝내도 될 것 같음 건성분들은 이 에멀젼을 추천하진 않지만 바른다면 좀 더 영양감 있는 크림으로 마무리하길 추천해드림

3. 아쉬운점
각질제거 기능이 있는데 다른 각질제거기능제품에 비해서 확실히 순하긴함
그래도 콧망울 옆부분이 가끔 예민한날엔 아주 살짝 따가움 
어쩌피 필링제 쓰는게 확실하고 좋은데 굳이 이 기능을 데일리 에멀젼에 넣었어야했나 싶음

4. 트러블 진정
진정효과까지 있다고 되어있었는데 확실히 있음 근데 내가 홍조는 있는데 트러블은 잘 나는편은 아니라 트러블 진정까지는 잘 모르겠음 피부에 쿨링감+편안함을 줘서 홍조도 좀 잡아줬기 때문에 트러블 진정에도 도움은 될거라고 생각함

5. 재구매의사 200프로 있음!! 피지잡아주면서 촉촉하고 진정효과도 같이 있어서 매우 마음에 들었음",5
"평가단리뷰입니당

꽤 이름있는 브랜드라 기대하고 받았는데 저한테는 그냥 쏘쏘한 로션이었어요!  트러블 케어라고 되어있지만 트러블이 케어되는 느낌은 받기 힘들었어요ㅠㅠ 그냥 세안하고 스킨바른 후에 듬뿍짜서 바르는데 향이 좀 좋은듯하면서도 기초제품이라기엔 좀 강한향이 나서 호불호있을것같아요 흡수되고나면 약간 촉촉한 느낌보다는 보송한 느낌으로 마무리되는 것 같더라구요 그렇다고 막 땡기고 하는건 아니라 나이트케어보다는 메이크업시 기초로 사용하기는 괜찮았어요 가격에비해 무난한 제품이었습니다!",3
아벤느 제품은 적지 않게 사용해봤는데 여태까지 크게 실망해본 적은 없는 것 같아요 이 제품도 그랬어요! 지성한테 안좋다는 쉐어버터 성분이 있어서 트러블이 나지 않을까 걱정했는데 여태까지는 이걸 쓰면서 여드름이 나지 않아서 만족하면서 쓰고 있어요 발림성도 괜찮고 유분기가 적은게 제일 마음에 들어요! 요즘같은 여름엔 얼굴에 기름이 뿜어져 나와서 유분기 있는 화장품을 안쓰는데 이럴 때 쓰기 좋은 것 같아요 단점을 꼽자면 용량이 적다는 것... 아마 여름 끝나기 전에 다 쓸 거 같아요 ㅋㅋㅋ,4
"트러블전용이고 또 평으로는 좁쌀에 좋다길래 저도 다행히 평가단돼서 사용해봤지만 글쎄요..입니다 ㅠㅠ 가끔 턱에 좁쌀이 올라오는데 이게 사라졌다 났다 해서 이 제품덕인지 헷갈려요 ... 발랐을 때 하루만에 사라지거나 하지는 않았어요 트러블제품에서 극적인 효과를 바라는건 무리인거 같아요 더욱이 그냥 붉은 트러블에도 발라봤는데 딱히 변화는 없습니다 ㅠㅠ 향은파우더리하고 제가 건성은
아니라서 당기지는 않는거 같아요 혹시나 하는 마름으로 좁쌀에는 계속 발라보겠지만 딱히 또 구매해서 쓰고싶지는 않네요 ㅠㅠ",3
누가 인생템이라길래 사서 쓰는 중인데 이거 바르고 좁쌀 나는 것 같음ㅠ 아직 확정은 지을 수 없어서 조금 더 써 볼 예정임. 턱 쪽에 나는 여드름 때문에 효과 보려고 샀는데 뒷통수 맞을 수도 있을 것 같음,2
"#평가단리뷰

사실 아벤느는 좀 비싸기도 하고 성분들 보면 안좋은 성분도 은근 많이 써서 이미지가 별로였는데 이거 써보고 너무 좋았음
여드름 제품 중학교때부터 웬만한 건 다 써봤는데 역시나 효과본 건 없고 그냥 무난하게 넘어가면 다행이었던터라 혹시나 하면서도 기대는 안했음
근데 성분이 향료가 많이 앞에 있어서 그런지 냄새도 엄청 진하고 좋아하는 향도 아니라 이부분은 살짝 불호임,,그런데도 이걸 안고 갈만한 가치가 있음!!!!
정말 가장 고민이면서도 제일 해결 안되었던 게 닭살피부 심한 사람은 알거임 얼굴 볼쪽에도 오돌토돌하니 좁쌀여드름 난거마냥 징그러운데 짜지지도 않고 없어지지도 않음 아무리 촉촉하게 해줘도 똑같음,,
근데 뭐 머리로 맨날 가리고 다녀서 별로 신경 안썼는데 어느 날 세수하는데 갑자기 낯설게 맨들맨들한 느낌이 드는 거임
그리고 거울 봤는데 진짜 거짓말 안치고 거의 다들어감,,,,나 이거 평생 안고 갈거임,,,제발 단종하지말아주세요!!!!!!ㅜㅜㅜ요즘 피부도 예민해서 막 붉게 올라오던 것도 나름 잠잠해졌음 (대신에 화농성 여드름을 막 잠재워주고 진정시켜주고 이런건 아님,,) 그리고 지성피부인데다 요즘 날씨 환장하게 더워서 이런 보송한 질감 너무 좋아함
심지어 앞에 입구도 엄청 좁아서 양조절도 쉽고 위생적임
나랑 평생가자,,가격 올라도 사랑해줄게",5
"토출구가 좁고 튜브형이라 양조절이 용이하고 발림성도 좋습니다. 여름이라 모공 늘어짐과 블랙헤드, 피지 폭발, 트러블이 종합선물로 찾아왔는데 마침 평가단에 선정되어 부푼 기대를 안고 제품을 받은 후 매일 사용중입니다.
효과는 글쎄요... 제품 쓰기 전후가 크게 달라진 점이 아직 없어서 현재까지 평점은 쏘쏘로 남깁니다.
지속적으로 사용 후 제품이 선전하는 효과를 보면 평점을 수정하겠습니다.
사용감은 바른 부위의 피부가 약간 화끈 거릴 때가 있지만 뒤집어지거나 하지는 않아서 꾹 참고 사용 중입니다.
기초 단계에서 적은 양을 고르게 펴 바르면 메이크업도 밀리지 않아요.
즉각적인 트러블 진정은 제주스프리 비자시카밤이 더 효과가 좋아서 각질 케어와 피부결 개선에 중점을 두고 지켜보려고 합니다.
용량에 비하면 저렴한 제품은 아니고 보습감은 거의 없어 여름에 지성, 복합성 피부에 적합하다고 생각합니다.",3
"건성피부가 쓰기엔 가벼워요. 많이 가볍습니다.
날씨가 더워지면서 에어컨을 켜니까 실내온도도 낮고 건조하기때문에
토너 후 이것만 하고 끝내면 건조해요.

끈적임 없고 바로 흡수 = 건조. 피부에 수분장벽이 다 증발한 느낌.
바로 흡수되어 매끈해도 땡기지않는 제품이 있는데 반해
이건 당겨요. 다음단계 케어가 필수.

저자극 각질케어성분이 있다고 하는데 몇 주 더 써봐야 할 듯.
3일정도 썼는데 트러블은 없네요.

덥고 피부온도도 많이 올라갔고 빨리 스킨케어해야할때 추천.
건성보단 지복합에게 추천.",3
"평가단입니다
여름용 가벼운보습제품이필요하고 피부타입도 트러블잘나는 지성이라 신청했음
사용감은괜찮은편 바른직후번들거리거나끈적이는일없이 필요한
만큼보습해준다 기대했던바에충실한제품

아쉬운게잇다면 성분....  아벤느나 비쉬같은 온천수컨셉 약국브랜드들이 보면오히려성분은
☆로인경우가많음...  그리고내기준에서향이너무
강함ㅠ 안그래도 향료시른데 향도내스탈아니고
꽤세다 적응이되긴햇지만 아쉽당..
여름용 가볍고산뜻한 보습제품찾으시면ㅊㅊ!
지성에여드름나면더 잘맞으실테구... 성분과향료에 민감하시면 글쎄일듯 거기에가격도좀나가는편이고...지난번에도 아벤느 크림?당첨됐엇는데 걔도무난히 한통다 쓰긴했지만성분이아쉬웠다...  아벤느는 성분 개선만 좀해주길 좋은제품많으니!",4
"일단 저의 피부는 수부지입니당!! 겨울철에는 많이 건조하지만 지금같은 여름에는 티존에 유분이 많은데요. 제품받고 꾸준히 써보았는데, 트러블 개선 제품인만큼 사용하고 트러블이 생기진 않았어요!!
또 제가 피부가 민감한 편이라 안맞는 제품쓰면 바로 얼굴에 나타나는데
역시 순하디 순한 아벤느 제품이라 그런지 발릴때도 편했어용
냄새는 향이 있는 편이지만 부담스러운 그런 향은 아니구 꽃향기나는 화장품??냄새입니당 ㅋㅋㅋ
발림성도 부드럽게 잘발려요! 
제품이 건조하고 아침에 일어나면 당긴다는 의견이 있는데 제가 사용했을때는 건조하진 않고 깔끔하게 마무리 된다는 느낌을 받았어요! 아침에도 다른제품보다는 유분이 덜 올라왔구요!
지금같은 여름철에 트러블성 피부를 가진 분들이 쓰시면 좋을 것같아요! 
아 그리구 주기적으로 트러블이 한두개씩 나는 편인데 이 크림 바르고 나선 올라오다가도 금방 가라앉는 느낌을 받았어요!뭔가 정돈되는 느낌?? 더 꾸준히 써볼 생각입니다! 
순하고! 부담없는 제품을 원하시는 분들께 추천드려요용ㅇ",4
"일단 요즘 에멀젼을 다 썼어서 새로운 걸 뭘로 살까 고민만 하다가 샘플들로 꾸역꾸역 대체하던 중이었는데요! 딱 평가단이 되서 기쁜 마음으로 사용했숩니다!
일단 이 제품의 가장 큰 장점은 무난함이라고 말할 수 있을 것 같아요! 이게 정말 단점이 아니라 장점입니다!
누구에게나 무난하게 맞는 제품은 그만큼 어느 피부에나 무난하게 맞는다는 말인데요! 딱히 트러블이 일어나는 제품도 아니라고 판단되었구요 유분기가 너무 많은 제품도 아니라고 생각했습니다! 모든게 적당적당해서 무난하게 사용할 수 있었던 것 같아요! 용기 입구도 작아서 적당히 짜쓰기에 좋았어요!
다만 향이 좀 강하다해야할까요? 제가 향에는 크게 예민한 사람이 아님에도 이 제품은 바를 때마다 특유의 향에 항상 띠용하게 됩니다..ㅋㅋㅋㅋ!! 분명 안 좋은 향은 아닌데 그렇다고 좋은 향도 아니고... 흠 향에 되게 예민하신 분이라면 피하시는 게 좋을 것 같아요! 하지만 다른 면에서는 모두 무난하게 좋았습니다!!",4
무난하고 순하다는 것이 장점인 제품이 아닐까 싶습니다. 그렇게 큰 효과는 없었어요. 트러블 진정 효과를 딱! 보지는 못했지만 전체적으로 진정 기능은 있는 것 같습니다. 그리고 단독 사용은 좀 어려울 것 같습니다. 촉촉한 편이 아니라 오히려 저한테는 건조했어요. 다른 기초 사용후 마지막에 한 겹 바르는 용으로 좋을 것 같아요. 순하고 무난하기 때문에 화장품 잘못 쓰면 트러블 나는 저에게는 좋은 제품이었습니다! 트러블도 안나구 마지막 마무리로 좋았어요,4
"정말 감사합니다..
제 피부에 맞는 제품 찾기가 굉장히 어려웠는데 글로우픽느님이 너한텐 이거야! 하고 이 제품을 투척 해 주셨나이다

저는 잘 맞는 기초제품이 한 두 개밖에 없었는데
저번에 글로우픽님이 하사해주신
아이오페 시카크림에 이어서
또 이 제품까지 너무 잘 맞아요 ㅠㅠ
인생템 자꾸 선사해주심ㅠㅠ

향은 베이비파우더향이라고들 하시는데
저는 그렇게 느끼진 않았어요
제가 베이비파우더향 안 좋아하거든요 !
그냥 기분 좋은 포근한 향이에요ㅎㅎ

발릴 때 유분감 많은 크림 마냥 스르륵 발리는데 바르고 나선 싹 스며들고 유분감 안느껴져요
뽀송보들합니다 지성분들한테 잘 맞을 것 같아요
흡수된 다음 얼굴 쓸어보면 보들보들한 느낌이 저는 꼭 이 제품 용기 만질 때 느낌이랑 비슷한 느낌인 것 같아요ㅋㅋ 이상한데 진짜 비슷한 느낌ㅋㅎㅎ 

스킨으로 닦아내고 이 에멀전 바르면 끈적임 하나도 없고 넘 행복하네영ㅎ히
건조함, 번들거림, 가려움 전혀 없고 트러블도 안 생기고 맘에 꼭 듭니당 . 

깔끔한 용기 디자인도 넘 예쁩니다! !

넘 조아서 매일매일 바르는데 오늘 문득 아 이렇게 쓰다가 곰새 다 써버리겠다 라는 느낌이 들어버렸어요..흑흑... 
아껴쓰기 싫은데 아껴써야 하나 싶고ㅠㅜㅜ 
저렴한 건 아니지만 넘 조타!!!! 할 새로운 제품을 만나기 전까진 재구매 해야 할 것 같은?! ㅎㅎㅎ",5
"평가단으로 제품 받아보게 되어 일주일정도 사용해보고 리뷰 남깁니다.
일단 제형은 에멀전보다는 되직한 제형이에요. 로션과 크림 중간이랄까? 적당한 수분감과 유분감을 가져서 유수분밸런스를 맞춰주는 느낌이었어요. 무거운 느낌은 없어서 여름철에도 사용하기 좋을것같아요.
솔직히 말하자면 트러블에는 효과를 잘모르겠어요 일주일정도밖에 사용안해서 그럴지도 모르지만 조금더 사용해보고 추가후기 남기겠습니다. 그치만 제 얼굴에는 더 나는 것 없이 순하게 무난무난했어요ㅎㅎ
근데 이 제품에 짱짱을 못 준 이유는 밤에만 사용해야한다는 것이에요ㅠ 아침에 바르고 화장하면 베이스가 다 밀리더라구요.... 화장전에는 얇게만 도포, 아님 저녁에만 사용하셔야할것같아요ㅠㅠㅠ
그래도 사계절내내 잘 사용할수있는 좋은 제품임은 확실합니다. 재구매의사 있어요!

+추가후기+
오 이거 짱짱으로 올립니다! 염증성 여드름에는 효과가 없는데 좁쌀여드름이랄 피부결개선에 너무 좋아요ㅠㅠ 완전 피부가 보들보들해지고 매끈해졌어요! 이번에 프랑스가는데 몽쥬 약국에서 쟁여와야겠오용~~~ 좋은 제품 알게해준 글로우픽 감사합니당.",5
"아벤느 제품은 요번에 평가단으로 당첨되서 처음 써보는데 저는 너무 좋았어요. 저는 수분부족 복합성이라 세안하면 얼굴많이 당기는 타입이고 토너 여러번 흡수 시켜줘도 얼굴이 금세 당기는 타입인데 토너 한번 하고 이거 쓰니까 속당김 같은거는 많이 나아졌어요. 무엇보다 얼굴이 민감성이라 너무 오일리한 제품이면 어떡하지 이러고 걱정했었는데 전혀 그런거 없었어요. 각질제거는 어느정도 해주는거 같아요. 화장할때 원래 많이 밀리는 편인데 이 에멀전쓰고 화장하면 잘 먹더라고요ㅎㅎ 향은 약간 수선화?냄새나는 로션같고, 에멀전치고는 조금 연고 제형같았어요. 그러나 오일리한거 전혀없었다는거!! 효과 좀 더 있는지 보고 구매하고 싶네요. 특히 각질 많이 올라오는 가을이나 겨울에 쓰면 딱 일거 같아요. 추천합니다",5
"요 라인 3통째 사용중~~~
 내가 요 라인 때매 아벤느만 사용하게 된 계기가 됨ㅎ
흡수도 빨라서 화장전 발라도 좋고 이거 낮에 쓰는 용도로 나왔는데 저는 이거 저녁에도 씁니다
이거 바르고 자면 트러블도 진정되고 아침에 일어나면 피부도 보들보들 해짐
이건 내 애정탬임ㅎ
대신 이건 기초 탄탄히 하구 마지막 단계에 발라주는 것을 권장함!!",5
"평가단에 당첨되어 사용하게 되었어요
일단 질감이 가벼운 크림같은데 얼굴에 올렸을때 오일리한 느낌이 없어서 좋아요 
용량이 크지 않아서 좀 올라오는 부분에 소량 발라주었는데, 여드름이 하루아침에 없어지는 드라마틱한효과 보다는  계속 써보면 효과를 볼수있을것 같은 제품이에요(사실 아벤느제품들은 친구가 한통 비울때쯤 효과본다고 하더라구요..ㅎ)
여름에 사용하기 무겁지않아서 좋은것 같습니다 밀리는감도 없구요",3
"평가단 선정되어서 사용해보게 되었어요
향은 무난하고 제형은 에멀전과 크림의 중간인거 같아요 저는 피지오겔 크림을 주로 사용하는데 이게 여름이 되면 답답해서 더울때는 피지오겔 에멀젼을 사용하는 편이거든요 
크림은 좀 무겁고 에멀젼은 너무 가벼워서 애매한 감이 있었는데 이 제품이 바르고 흡수되는 정도가 딱 좋긴 하네요..
피지오겔만 사용했었는데 아벤느도 좋은 제품인거 같아요 얼굴에 듬뿍 발라도 뾰루지 같은거 안나요 ㅋ",4
"향은 일단 뭐랄까 어떻게 맡으면 로션냄새 같기도 하고 연고 냄새같기도 해요

제가 사용했던 아벤느 제품들의 특징이 유분기가 많다는건데 이 제품도 제형자체는 로션같으면서도 바르고 나면 뭐랄까 유분막이 씌워진듯한...? 그런느낌으로 마무리돼요 이걸 뭐라고 설명해야하지 약간 미끌미끌한...?

근데 또 시간이 지나면 이게 흡수가 되서 유분감은 크게 거슬리지는 않았어요 트러블용 에멀전이라서 요새 뒤집어진 피부에 저녁마다 사용해줬는데요

여드름이 생기거나하지는 않았고 원래있던 트러블이 조금 가라앉는 정도얐어요 하지만 완전히 가라앉지는 않고 자,이친구야 진정해봐 어허
이런느낌으로 가라앉혀줍니다

와 대박 이런게 아니라서 무난무난하다고 보시면 될것같아요",4
"
<평가단 리뷰>
-용기가 위생적이라 좋아요
-처음에 파우더리한 향이 너무 강해서 걱정했는데
  다행히 바를 때에만 향기가 나고 금방 다 날라갑니다
-제형은 크림과 로션의 중간정도?
  펴바를 때 부드러운 슈크림 같아요
-무게감도 크림과 로션의 중간느낌
  꾸덕한 크림들 보다는 가볍지만 어느정도 보습감이 있기 때문에
  화장하기 전 보다는 밤에 바르는걸 더 추천합니다!
-트러블 케어로서의 기능성은 그닥;;
-마무리감도 끈적임이 없어서 좋지만
  제품설명대로 보송하다고 하기엔 무리가 있어요;;
-가벼운 여름용 크림으로 추천",4
