content,rating
"1달동안 사용후 후기입니다.
전에 이니*프리 그린티 로션(복합성)을 사용했습니다.
그러나 별차이점을 못느꼈고 오히려 가격이저렴한 좋은 이니*프리제품을 생각이 들었습니다.

사용감은 수분감있게발리면서 흡수력이좋습니다.
하지만 3~4시간후 유분이 올라오기때문에 여름이 다가오는 지금은 로션 단독으로 사용하는것을 추천드립니다.",3
촉촉합니다,4
"유수분 잘 맞춰주는 본연의 역할에 충실한 로션
무슨 기능이 있는 것은 아니고 정말 딱 유수분 맞춰줌
지성은 여름에 이거만 발라도 될거 같아요
수부지는 수분이 많이 함유된 크림 덧발라주면 될거 같아요",4
극지성인 내가 겨울 내내 쓰면서 난 지성이 아닐지도 몰라 라고 착각하게 만든 제품ㅋㅋ 역시나 날씨가 따뜻해지니까 오후엔 기름이 스멀스멀 올라오지만 이 정도면 아주 좋습니다! 가격도 제 가격 다 주고 사는거 아니니까 나쁘지 않고 수분만 만땅 채워주는 띵제품! 3통째 쓰고 있습니다!,5
제가 처음으로 재구매한 로션이에요! 원래 다른 로션들은 쓰고 나서 크게 좋은 걸 모르겠기도 하고 질려서 맨날 브랜드를 바꿨었는데 이건 아마 계속 쓸 거 같아요! 그만큼 진짜 좋아요 .굿굿. 너무 번들거리지도 건조하지도 않아서 사계절 무난하게 씁니다! 겨울엔 건조하다 싶으면 수분크림 더 발라주고 여름엔 이것만 발라요ㅎ,5
여름엔이거예요 개기름좔좔인저한테는 진짜 잘맞아여ㅜㅜ 여름엔 밤에만바르는데 진짜 트러블도 잘안올라와용,4
10통 가까이 쓰고 있어요! 로션이 스킨에 가려져서 큰 효과가 눈에띄게 보이지 않는 것 같지만 보습효과와 촉촉함도 적당한 거 같아요..! 가격이 쪼오금 그렇지만 계속 사서 쓸 의향 있어요오~,5
"흡수가 빠른 편이다
촉촉하고 가벼운 느낌
덧발라도 흡수 잘 됨",4
사용하고 있는데 그냥 진짜 무난하게 괜찮은 것 같아요!!제가 진짜 민감성 피부라서 화장품 바꾸면 트러블 엄청 올라오는데 얘는 진짜 순하고 아무런 트러블도 안올라와요!!!!!!가격 비싼거만 빼면 좋아용,5
처음에 바른 2일정도는 약간 붉게 올라오고 그랬는데 적응기간이었는지 그이후는 전혀 안그러고 좋음. 트러블 안나고 향 좋고 그냥 무난히 좋음. 갠적으로 지금까지 쓴것중에 설화수다음으로 제일 괜찮은듯.,4
빌리프 짱짱 ㅠㅠ 가격빼고 다 좋습니다,5
"무난한걸 가장 좋아해서 쓰는제품입니다.
가격이 무섭다는점이 아쉬워요",3
무난하고 순해서 데일리로 쓰고 있어요,5
촉촉하고 적당이 유분기가 있어서 사계절 내내 사용하기 좋음!!  피부가 좀 민감해서스킨케어 잘못하면 바로 홍조 올라오고 트러블이 나는데 이거 사용하는동안에는 그런거 하나도 없었음!!빌리프는 진짜 믿고쓴다,5
산뜻하지만 가격대비 너무 비싸다.. 쓰다보면 완전 좋은지는 모르겠고 그냥 무난하게 쓰기 젛은디 나무 비싸..,3
무난하고 순해서 쓰고있어요~,4
"로션의 정석이라는 말이 딱 어울릴 것 같음. 발랐을 때 무겁지 않으면서 그렇다고 너무 가볍지도 않고, 유수분이 적당해서 너무 기름지지도 건조하지도 않음. 성분도 괜찮은 편이고 실제로도 사용 후 트러블 나는 일은 없었음. 솔직히 유일한 단점은 가격이라고 생각함. 용량대비 넘비싸ㅠ",5
"세이지 오일이 안맞는데 이 제품에는 세이지잎 추출물이 들어있길래
오일은 아니니까 괜찮겠지 싶어서 발랐는데
열감 올라오고 뭔가 답답한 느낌 들어서 바로 다시 세수함
세이지 성분 안맞으면 조심해야됨",2
"촉촉하고 텍스쳐가 무겁지 않아서 부담스럽지 않음
보습 잘되는데 가벼운 텍스쳐라 보습 걱정하는 사람들은 모이스처라이징밤이나 안티에이징밤이랑 같이 쓰면 좋을듯",4
촉촉하고 가볍고 듬뿍 발라도 화장이 안밀려요,5
올해 중3된 울딸래미가 이것만 씁니당 나름 화장품 엄청 까탈스럽게 골라 쓰는데 딴 거 사다줘도 다시 이걸로 사다달래요 좋은가보다 했는데 우연히 쓰게됐는데 피부가 편안하고 별다른 트러블 없고 촉촉하고 좋아요,4
무매력이 매력인 제품 순하고 제품이름처럼 밸런스를 잘 맞춰줌 건성이지만 너무 유분기 도는거 싫어하는 나에게 적당한 유수분 밸런스를 맞춰줌 지금은 딴걸로 갈아탔는데 다시 이거 살려구요ㅠ 피부결개선 효과도 어느정도 있는듯 쓸때는 모르고 딴제품으로 갈아타보면 이제품이 좋았구나~ 싶다,4
부드럽게 발리고 전 나름 괜찮았어요,5
"전 너무 좋았어요!!! 
지성도 건성도 고루 편한 제품!!
적당히 피부에 남는데 쫀쫀하게 붙어서
화장하기 딱 좋은 피부결 만들어요 : )",5
"건성+민감성이지만
유분기 과한 제품쓰면 토해내는 피부인데
겨울에 쓰기 굿굿이에요
봄,가을용 토너+플로리아 에멀젼 쓰면
당기지않고 괜춘하네용",4
"제가 이라인 크림사면서 1대1로 에멀젼을 사은품으로 받았는데 100시간 크림보다 이게 훨씬좋아요!!!! 홍보하는거보면 100시간크림이 100간동안촉촉하다고해서 (겨울이고 히터때문에 산거였는데) 샀는데 크림바르고 더 당기더라구요 베이스도 갈라지고ㅠㅜ(그래도 약민감성인 제가 트러블은 안났어요!)그래서 사은품으로 받은 에멀젼써봤는데(이 상품케이스 리뉴얼됐나봐요?이름은 똑같은데 케이스가 달라서 했갈렸어요ㅠㅠ) 이거 진짜 촉촉해요! 약간 수부지에게 찰떡일것같아요! 저는 토너팩하고 이것만 발랐는데(따로바를게없다보니ㅠ) 건조하다는 느낌을 못받았어요! 나중에 할인할때 한번 사보세요!(정가로 주고사기에는 아깝잖아요? 저만그런거아니죠?ㅎ 모든화장품을 할인할때)
아그리고 향이 약간 남자스킨냄세같은 향이나요!ㅠㅠ 제가 향에 좀 민감해서 저같은분들은 참고해주세요!!",4
이 라인 스킨이랑 비슷해요. 촉촉함 보다는 유분이였어요...,3
이건 말않해도알거임 이거 3주쓰면 주름 옅어짐,5
향이 좋고 보습력 좋아요. 저에게는 유분기 많지 않았구요 유수분 밸런스 적당했어요. 빨리 스며들고 잘 흡수되는 느낌이고 마무리가 끈적이지 않아서 좋았어요.,3
"이거 좋아여!
토니모리 처음으로 좋았던 기초 같아요
로션인데도 보습좋고 촉촉하고 
로션답게 무겁지 않아요
정말 뭐라고 설명한 방법이 없는게 너무 아쉬워요
이거 정말 좋아요",4
겨울철에 사용했을때도 건조함이 없었고 피부트러블도 유발없이 촉촉하게 잘 사용했어요 #촉촉한 #끈적이지않는 #추천템,4
"이건 아침에 사용하기보단 밤에 자기전 사용하는 걸 추천합니다 
밤에 쓰면 다음날 세안하고 피부 촉촉하고 좋은데 
화장전에 바르면 번들거림 ㅋㅋ꿀광느낌과는 좀 다른 ... 개기름 느낌내기 좋아요",4
"유분이 충분해서 이건
바르는 날은 따로 크림 안 발라도 충분했어요!",3
좋아서 샀지만... 건조했어요ㅠㅠ,3
"예전에 한창 여드름 나는 시절 발랐다가
기름이 더욱 폭발했던 아픈 기억이 있음,,
유분감이 너무 많았던 제품.",2
이거 진짜 고3부터 대학 1학년까지 거의 1년~1년반동안 썼어요 저는 성분에 딱히 민감한 피부가 아니여서 피부 건조함만 잡아주면 되는데 이거 썼을때 꿀피부로 살았답니댱 ㅎㅎ,5
"선물받아서 사용중인데 처음 바를 때 인조적인 향은 그저 그랬어요
민감성 피부라서 얼굴에 트러블이 나지 않을까 걱정했는데 오히려 촉촉하고 순해서 놀랐습니다!
수부지 피부인데 유분이 많지 않아서 잘 맞았어요",4
복합성의 겨울 필수템 촉촉하게 발리고 흡수가 잘되는게 장점 하지만 단점은 바르고나먄 유분기가 좀 기분나쁘게 돌아서 화장이 그렇게 잘먹지는 않음 하지만 촉촉하기에 포기할수없음,4
유분이 많아서 저한테는 조금 별로였어요 기능에 비해서 가격이 비싼거 같다는 느낌도 들구요ㅠ 재구매 의사는 없어요,3
촉촉한 로션제형이지만 좀 부담스러울 수 있는 향인 것 같아요 약간 남자 스킨냄새가 나서 향에 예민한 저에겐 좀 힘들었습니다ㅠㅠ,2
"촉촉함 오래 간다고 해서 사봤는데 그닥 오래 가지도 않고 약간 유분이 더 많은 느낌임

걍 그럭저럭 쓸만 했음",3
지복합성인 저한테 별로네요 ㅠ 유분이 많아서 건성이신 분들이 쓰면 딱 좋을 거 같아요,3
촉촉하고 보습감 만족해요,4
쫀쫀함 향도 좋음 펌프 형식이라 다 써도 내용물이 남아 있음,4
"엄청 촉촉하진 않지만, 그럭저럭 괜찮아요",4
예전에 썼던 제품이고 지금은 한 번 산양유 쓰고 있는데 다시 이 제품으로 돌아갈 듯 건성분들 이거 크림까지 세트로 사세용 진짜 촉촉해요,5
"조금씩 눌러서 쓰는 체형이라 좋고 
냄새도 좋은편이고 
발랐을때 촉촉하고 
건성한테 좋은것 같아요",4
"별로였음.. 정말 걍 별로,,",2
땡김없이 잘썼어요! 에멀젼인데 다른 제품에 비해서 촉촉하기두 했구여! 얼굴에 두껍게 바르지 않은 이상 트러블 난적도 없어요! 무난하게 쓸수있는걸로 추천해용,3
건성피부에만 추천해주고 싶어요 방송해서 유명해졌지만 복합성피부인 저한테는 안맞네요ㅜㅜ,2
지성이지만 겨울에 토너랑 같이쓰니까 피부 좋아지는게 눈에 보였다 처음 며칠은 얼굴에 과한 유분감에 좀 놀라지만 한달정도 지나면 피부가 엄청 좋아지는걸 느낄 수 있다,4
건성분들이 쓰시기엔 좋아요 바르고 나면 매끈해집니다! 펌핑식이라 바르기도 간편하구요 다만 뚜껑이나 그안에 껍질이 살짝씩 벗겨져서 바르고 나면 그게 얼굴에 붙어있어요 하지만 떼어내면 되니까~,4
보습보습하다ㅎㅎ 흡수되는 촉촉함과 얼굴에 남는 유분의 비율이 적당해서 맘에 듬,5
"저한텐 겨울용으로 괜찮은 제품이었어요.
플로리아 라인을 다같이 사용해봤는데 그냥 무난? 여름에 쓸때는 얼굴이 기름져서 못쓰고 겨울에는 나름 잘 썼던거 같아요.
이 제품 또한 큰 효과는 안바라지만 트러블 유발안하길 바라는 분들이 쓰면 무난하게 쓸 수 있을꺼 같네요!",3
촉촉해요 근데 뚜껑안에 습기가 잘차요,4
그냥 쓸만했으나 재구매의산 없다 딱히 좋은건 못느꼈음,3
"고딩때 이것만 계속 썼던 기억이 나네요! 건성피부였는데 스킨 로션에 100시간 크림까지 쓰니까 너무 좋더라구요
가을겨울에 쓰기에 보습력이 좋아용
지금은 한율로 갈아탔습니당 헤헿",4
"로드샵 제품중 보습력은 끝판왕같아요 이 가격에 이만한 보습력은 따라오기 힘들만큼 보습이 정말 뛰어나는 건 맞아요! 그래서 봄,여름에 쓰기엔 너무 무거워요ㅠ 가을, 겨울에는 플로리아로 기초하고 화장하면 화장도 잘 안뜨고 좋아요 가장 좋은건 화장품 향기가 너무 좋다는 거에요 이 향기가 담긴 향수가 나왔으면 좋겠다는 생각도 할만큼 향기가 참 마음에 든 제품이고 입술이 건조해질 때 발라도 괜찮더라구요 입술이 자주 건조해져서 팩처럼 바르고 자는데 다음날 일어나면 입술도 촉촉해 지고 너무 좋아요",5
촉촉함도 좋고 다 좋은데 그 촉촉함이 오래 남지 않아서 조금 아쉬운 제품.... 기초만 하면 촉촉해서 좋은디 그 위에 화장을 할때가 사용하기 애매함....,3
지금도파는지모르겠지만 로드샵치고 만족하며 썼던 기억이...,4
보습 끝판왕 6년째 건조계절이 되면 이것만씀 ..,4
"예전에 쓰다가 나는 그냥 그래서 안쓰고 냅뒀는데
굴러다니던걸 내 남동생이 주워썼다
매우 만족해하더라
아마도 겨울이었는데 자기얼굴이 맨질맨질 탱탱해진것 같다며 자꾸 만져보라고..... 고역이었다
화장품은 1도 바르지않다가 발라서 그 효과가 극대화된 것인지는 모르겠으나
나도 얼굴 막 갈라질땐 괜찮게 썼고
복합성인 동생도 꾸준히 열심히 잘 썼으니
가성비는 나쁘지 않았던 듯
재구매는 안한다.... 
아마 내 동생이 하겠지",4
"친구가 진짜 좋다고 추천받아서 샀는데
너무 눈이 따가워가지고 눈물이 계속 찔끔찔끔 
얼굴이 미세하게 작은 여드름같은 홍조빛이 보이길래 
아... 나한테 안맞는구나 하고 안썼습니다 
댓글보니 자칫 얼굴이 뒤집어지는것 같은데 
그정도 되기전에 안녕해서 다행일세 
나같은 극민감성은 화장품 좋아해두 막 쓰기가 무섭다니깐",1
"토니모리에서 로션을 하나 산다면 이것!!! 
진짜 이건 처음바를땐 잘모른다 ㅋㅋㅋ 근데 다써갈때쯤되면 로션 여러개가있어도 얘한테만 손이감 ㅋㅋㅋㅋㅋ
다쓴후에도 자꾸 세일안하나~ 기웃거리게되고 ㅋㅋ 
.
건성기준으로 진짜 탁월한 보습감 ㅋㅋㅋ 건성들은 only수분감으로는 잘 만족못하는 경우가 많다 어느정도 유분이 좀 채워져있어야 아 스킨케어 좀 했구나~싶은 경우가 많은데 얘가 그 니즈를 잘 채워줌!ㅋㅋㅋㅋㅋㅋㅋ",5
한동안 나의 겨울을 함께해주었던 꾸덕템이었음 세일해서 산거였지만 겨울의 복합성인 나의 피부에 괜찮은 아이템이었고 한동안 잘썼는데 겨울이 아닌 계절에 쓰기엔 좀 무거워서 결국 갈아타게 됬지만 토니모리 제품치고는 괜찮았음,4
"유분이 좀있음
건성인분 추천
나이있으신분 추천",4
"진짜 기대안하고 샘플썼다가 다음날 아침에 너무좋아서 당장 본품샀던 제품.
본품 한통 쓰다보니 또 무난해져서 갈아탔지만 쓸 당시엔 만족!",4
"겨울에 쓰기 좋았음. 
내 피부는 건성이라 보습에 가장 많이 신경을 쓰지만,  너무 끈적거리는 제품은 싫어함.
이 제품은 수분과 유분이 적절히 믹싱됐음. 
향도 거부감이 드는 향이 아니었고 부작용도 없었음.
그래서 한번도 화장품을 재구매한적이 없었는데 했음",4
그냥 일반적인 로드샵 로션,3
이거 단종되면 토니모리앞에서 1인시위할사람 급구함,5
양도 많구 세일할때 사면 좋더군요!!촉촉해서 환절기나 특히 겨울에 바르니깐 좋아용!!,5
"흡수도 잘되고 데일리템으로 딱이었음
건성들한테도 굿임",4
"플로리아 뉴트라 에너지 토너와함께 최애템인 이아이~
3년째 이제품만 고수하네요ㅋ
중간에 명품도 같이써보고 갈아타볼까했지만
이가격에 이렇게 촉촉하고 좋은 로션 없는것같아요
일반 물 제형 토너나 묽은 로션으로 택도없는 건성분들
저렴한 로드샵으로 효과보고싶으시면 꼭써보시길~",5
"이거 쓸때 피부진짜 좋아졌음
뭔가 피부가 꽉꽉 채워지는 느낌??
건성이라 그렇게 유분감 많게 느껴지지는 않았음
완전 강추하는 템!!!!!!!사세요!!!!!",4
"아토피인 친구가 추천해서 씀
유목민인 제가 2년 쫌 넘게 썼으니ㅇㅇ 무난하게 좋다고 할만함
그러나ㅜ 제 피부가 잘못이겠지요.. 이걸 잘 못 받아들여서 여전히 속은 당겼던게...ㅜ..ㅠㅜㅠ..
그리고 유분이 좀 있는지 가아아아끔 트러블이 났음
엄청 추천!!은 아님..",3
"전 이거 별로..
건조한 피부인데 유수분 밸런스 완전 똥으로 만들어줌
겉은 기름기 좔좔인데 속당김을 못잡아줌
다른 기초제품으로 보완할 수 있지만
이걸사용하면서 이거 괜찮다! 하는 느낌 받은 적이 없어서
별로 드리겠습니당",2
"촉촉해서 좋았어요
같은라인으로 수분크림도 같이 사용해보니 더 좋아요
로션으론 유분을 채워주지 못한거같지만 수분크림이 적절한 유분이 있어서 같이 사용하면 더 좋아요",4
맨처음엔 흡수가 안되고 너무 들뜨는느낌이어서 답답했음 근데 쓰다보니까 적응이되서 그런건진 몰라도 피부결이 보들보들해짐,4
좋아요! 좋았습니다! 가볍고 촉촉하고 당김고 없고 보습도 좋았어요!,4
스킨이랑 로션은 항상 처음 바를 땐 피부에 잘 받고 촉촉하고 그런데 점점 가먄 갈수록 효과가 덜한 느낌 ㅠㅠ 그래도 무난해서 두 통째 쓰는 중,3
"쓰면 쓸수록 적응되서인지 괜찮았던 제품 
그래도 재구매의사는 없음!",4
"우와 이거 고딩때 잘썼던 기억난다ㅋㅋㅋㅋ
추억의 아이템ㅎ 부드럽고 촉촉해서 좋았던 제품이에요
그 때는 뭘 써도 좋을 때였겠지만...",5
"세일할때 사본제품
트러블이완화되거나 그런제품은아니고
저렴하게 잔뜩바르는용도정도
나쁘지도 엄청좋지도않은 가성비괜찮은에멀전",4
스킨사려다 잘못집어옴.. 너무 기름져서 안쓰다가 겨울이라 다시 사용하는데 무난하고 좋아요! 촉촉하고 보습감도 좋은듯 허나 너무 무난해서 또 사진 않을듯 해요..,4
유수분다없는 사람이 쓰기조음 수분이4유분이6정도,3
겨울에만 쓰기 좋은 로션,3
아이라인만쓰려구요..,2
지건성 복합 피분데 건성인 부분에는 딱 맞아요 건성이 좀 심할 때도 이거 하나면 피부가 당기는 느낌이 안드네요 지성인 부분은 처음에는 기름 바르는줄 알았는데 쓰다보니 피부가 좋아지는 느낌을 받았어요,4
저는 건성이라 뽀송하고 좋았어요,4
좋지도 나쁘지도않은 무난한 제품!! 근데 약간 유분이 많은듯한 느낌이 없지않아 있음. 분명 건성인데... 이거바르고 아침에일어나면 얼굴에 개기름낀 느낌이랄까.....,3
로션때문에 스킨을 사죸ㅋㅋ그냥 늘 세트로 사는 제품. 건성인 저는 여름에 발라도 무겁지 않고 저는 좀 쫀쫀하고 빛나는 건강한 피부처럼 보이는 걸 좋아해사 그런지 이게 맞는 것 같아요. 이거 쓰고 피부 트러블 생기거나 한적없구 지금 2통째 쓰고 잇어요. 건성인 분들에게 추천추천!,5
"쓸 때는 크게 좋은거 못 느끼다가 다 쓰고 며칠 안쓰면 아 그거 빨이었구나 하고 재구매를 부르는 제품임
피부가 전반적으로 안정되고 탄력이 생김 보습은 적당함",4
4년째 쓰고 있는 제품이에요. 다른 제품들은 2통 쓰면 효과가 없어서 입 주위가 땡겼는데 이 제품은 4년째 계속 쓰고 있어도 그런게 없어요. 오늘도 인터넷으로 시켰네요ㅎㅎ,5
"겨울에 처음 언니를통해 이 제품을 접하게됐는데
정말...정말 너무꿀꿀꿀템ㅜㅜㅜㅜ
악건성은아니고 건성피부인데
진짜 너무촉촉하고 좋더라구요ㅜㅜ
아마 지성피부엔 유분이많을수도있는데!
건성에겐 정말정말 강추합니다
사랑해요토니모리",5
"일단 유분감이 많은 제품이예요
전 건성이지만 수분부족형 건성이라
보습보다는 촉촉한 라인이 좋더라구요
저한테는 좀 무거운 느낌이라 별로였는데
보습 원하시는 분들은 맞을수도 있을 거 같아요",2
엄마가 사랑하는 토니모리ㅎㅎ... 엄마 덕분에 토니모리 vip 됐어여ㅋㅋㅋㅋㅋㅋ 이 라인 스킨로션만 벌써 몇 통을 비우셨는지 모르겠어요ㅋㅋ 4년째 쓰시는 듯? 스킨에 비해 에멀젼은 한 번 펌핑했을 때 나오는 양이 적어요.. 이게 답답하면서도 양조절이 가능해서 좋아요,4
제품도 좋았고 흡수도 빨라서 좋았음,4
꽤 ㄱㅊ,4
"로드샵 기초 중 가장 만족했던 제품
1. 펌핑식 용기
2. 나이아신마이드
지성에게는 추천하지 않고 복합~건성에게
난 복합성이라 겨울에 썼다
근데 리뉴얼하고 가격 올리면서..뭔가 신뢰감이 없어졌음..",4
언ㄷ제 써도 괜찮지만 특히 쌀쌀해지고 써도 촉촉한 라인~,5
유분 꽤 있고 말 그대로 에멀젼 기능 충실히함!,3
내가이거썼을때 좁쌀 많이없어졌던것같은데 다시사야될듯 ㅠㅠ,4
지성인 나에겐 겨울에도 너무 리치함 밤에나 바르지 낮이나 여름엔 절대 안바름,2
이거 쓰고 트러블났어요 ㅠㅠ토니모리스킨케어는 저한테 안맞아요,2
"유분장난아님
흡수?못하는것같음
내피부에는안맞음 ㅜㅜ",2
완전좋아요 바르고 나면 피부가 부들부들 하지만 지성한테는 유분이 과할꺼같아요,4
"진-짜 수분용~ 
이름만보고 키엘꺼 저렴이인줄알았는데 완전 달라요 
산뜻하고 지성이 여름에 발라도 좋고 건성이라면 이거바르고 유분감있는거 더 바르는게좋아요 
파데랑도 섞고 오일이랑도 섞고 여기저기 섞어서 많이 쓰는 무난템입니다 
단독은 그냥 무난한데 뭔가에 섞어서 쓸 용도로는 얘만한게없어요",4
유분은 거의 없이 딱 수분만 느껴져서 지성인 저한텐 그부분이 좋았어요. 그리고 개취지만 향도 정말 좋아요 킁카킁카... 하지만 어느정도의 수분 보충 빼고 특별히 다른 기능은 없는것 같네요. 무난템이지만 재구매 의사는 있습니다 ,4
동생이 줘서 쓰게 됐는데 너무 좋아서 다시 재구매한 제품이에요 일단 성분이 너무 좋고 순하면서 보습도 잘돼요 악건성만 아니라면 바쁠땐 이거하나로 충분해요 향도 좋고 질감도 좋아요,5
이거 기대 전혀 안한 제품인데 너무 좋았어요!! 수부지 분들에게 추천합니다. 수딩 느낌의 제형으로 촉촉하게 바르고 마무리감 또한 촉촉해요ㅠㅠ 발림성이 좋아 막쓰다보니 의외로 금방금방 써지는 제품입니다,5
그냥 싼 맛에 순하게 쓰기 좋은 제품이예요 사면 후회는 없지만 재구매도 없다 ..,3
저렴하게 슥슥 바를수 있는 로션이 필요해서 샀는데 맘에 들어요 유해성분도 거의 없구 가격도 이만하면 훌륭하규요 순하구요 피부에 어느정도 보습효과를 줘서 아주 건조한사람 아니면 이거로도 여름에는 충분할것같아요 유분기가 거의 없어서 겨울에는 크림 꼭 같이 발라야항것같아요,4
피부가 엄청 예민해서 남들 다 맞는거 발라도 저는 피부가 뒤집어져요ㅠㅠ 아마 피부장벽이 다 무너져서 그런건가 성인여드름이어서 그런건지 아직 원인은 파악을 못했지만 시드물 울트라페이셜로션쓰고나서 얼굴이 진정되더라구요 전혀자극적이지않고 흡수도 잘되고 지금2통째쓰고있는데 아마 앞으로도 계속 이거쓸듯요,5
"유분이 많은 저에게는 그저 그런 제품 ..
시드물에서 추천해줘서 사용했는데 
그렇게 좋은 점은 모르겠으나 
큰 단점도 없어서 쓰는중 !",3
좁쌀 오져요 얘가 원인이 아닐까 해서 한참뒤에 한번더 사용해봤는데 얘가 원인이었음ㅋㅋㅋㅋㅋ쿠ㅠㅠㅠ 아직도 안없어져서 슬프다,2
속건조에 좋다고 해서 구매했으나 여름엔 파워지성 겨울이되면 건성이 되는 저에게는 여름에는 답답하고 겨울에는 바르면 촉촉하지만 금방 날아가는 느낌이에요.,3
무난하게 쓰기좋아요!! 향도 안나고 순하단 느낌이 들어용,4
"로션이라고 되어있지만
크림 제형이다
반투명한 흰색

시드물 홈페이지에서 봤을때는
알로에 에센셜 쯤 되는 크기겠거니 했는데
받아보니 마다가스카 크림정도의 크기이다
얼추 내 보조배터리 정도된다
뚜껑이나, 짜면 나오는 모양새가 폼클렌징같다

향은 달달한 편

발림성이 딱 마다가스카르 수분크림같다
솔직히 아직 차이점을 잘 모르겠는데, 굳이 구분하자면
그 수분크림보다 유분이 약간 더 느껴진다는점?
그렇지만 이것도 여전히 유분기가 별로 없는 가벼운 느낌이기때문에
건성분들은 매우 부족하다 느낄 수 있을 거 같음
나는 쓰던 앰플이랑 오일이 있어서 같이 발라주고 있음

발림성은 좋은데 흡수가 더뎌서
한참 얼굴을 뚜들기고 있어야 한다

가격은 저렴하고..
나한테는 무난하고 취향에 잘 맞는 크림이라
다음에 또 재구매할 듯

//지금 겨울 다가오니까 이걸 크림처럼 쓰기 많이 부족한 느낌은 드네요
겉이 덜 촉촉한 기분이예요
오일 쓰면 좋고
집에 있는 크림을 위에 발라주면 완벽해집니다
수분감이 조금 아쉽네요",4
