content,rating
"된느낌보다는 묽은 로션제형인거같아요. 부드럽게 잘발려요~
유분감이 처음에는 쫌있는거같은데 흡수하는속도가 빨라서 끝마무리가 보송하고 촉촉하게 마무리되네요.
피부가 쫀쫀해진거같아요~ 유분감이 마무리까지 조금만더 있었으면 하는생각입니다!",4
제형은 완전 내스타일인대 여드름남,2
"뭐랄까..  굉장히 무난한 제품
적당히 촉촉하고 뭔가 다 적당하다
그런만큼 뭔가 특출나게 좋진 않다",4
이게 스킨에멀젼이 다포함되있는건가용?ㅈ샘플써봤는데 가벼우면서도 촉촉하고 좋은것같아요!,4
어떤 분 댓글대로 건성지성 계절 안가리고 쓰기에 적합하단 말이 딱 맞는 제품. 바르면  피부 탄탄하게 만들어주는 느낌이 남. 마무리는 깔끔하게 다 흡수가 되고 끈적임 없이 촉촉함.,4
처음에 딱 바르면 유분기가 많이 느껴지는데 나중에는 완전 촉촉해짐! 여름에는 못썼지만 환절기나 겨울에는 좋음,4
베이비로션 쓰다가 처음 써봤는데 민감한 피부에 쓰기도 좋은거같아요,4
무난하고 무난해요 ,3
촉촉한 것 같음 다른 건 잘 모르겠어서 아직 계속 쓰고있음,4
유분감이 많이 느껴지는데도 부담스럽지 않고 무난했어요.,4
뭔가 제가 바르기에는 리치해서 손이 안갔던 것 같아요! ㅠㅠ,2
"건성지상 남성 여성 상관없이 무난해요
가격도 소셜로 사면 싸서 괜찮아서 3ㅡ4통쓰고있어요
진짜 그냥 좋은건 모르겠고 민감성인 저한테 트러블없이 무난",4
겨울엔 이제품 사용해요~ 촉촉하고 속당김이 없어요,5
무난무난 괜찮아요,4
"진짜 유수분 밸런스가 적당한 무난템
 민감성인데 가렵거나 붉어지지 않고 촉촉하게 사용할 수 있음!! 사계절 내내 사용할 수 있을듯!",4
"돈 없어서 못사는 게 아니라 집에 샘플이 쌓여있어서 사고 싶어도 사지 못하는 제품
유분도 적당하고 촉촉해서 속당김 느낄 때마다 발라줌 향은 약간 남자 스킨 냄새 같은 향..? 이거 바르면 후각 예민한 친구들이 얼굴에서 남자 냄새 난다고 함.
건성, 복합성, 지성 그리고 사계절 내내 무난하게 사용할 수 있는 거 같음

언젠가 집에 본품 양 뺨치게 쌓여있는 샘플을 다 쓰면 구매할거야. 살거야. 근데 언제 다 써...",4
"수부지인 나한텐 그냥그저 그럼
봄여름엔 얘 안 쓰고 토너만 쓰고 가을겨울엔 얘까지 씀",4
좋긴좋은데 가격대비별로 뭔가흡수잘안되는기분,3
촉촉한게 저는 너무너무좋아요!! 그런데 화장품향이너무강해서.... 그것만빼면 진짜좋은데 향이너무강해요 향이..,4
그냥 무난템~ 좋은지는 잘 모르겠음 선물세트에 들어있어서 써봤는데 아마 직접구매하진 않을듯,3
계절 상관없이 잘 쓸수 있는 아이템. 엄마 권유로 사게 됐는데 토너랑 같이해서 3통정도 쓴거 같음. 이거 쓰고 피부가 좀 좋아지기도 한거 같고 트러블 같은건 잘 안생기는 듯,4
샘플로 엄청 많이 써본 제품. 보습력 등등 로션으로서의 기능을 충실히 하는 제품이었다. 근데 향이 너무 싫어서 구매의사는 없다. 제품은 괜찮은데 향이 싫어서 샘플도 억지로 사용해서 없애버렸다.,3
"가볍고 흡수 빨라서 좋음!
하지만 엄청난 수분감은 만족하지 못 하므로 
수분크림 필수!",5
무난함..  무난하니 트러블도 안나고 딱히 나쁠것 없는 제품,3
저 모이스트젠 세럼 크림까지 풀세트로 쓰는데 이거 유분기 많아요... 저 건성지성 다잇는 복합성피부인데 이거 쓰면서 좁쌀여드름 비립종 계속 올라옵니다... 20대는 빌리프가 최고인듯... 괜히 삿네 ㅠ,2
"사계절 내내 써도 괜츈~ 흡수 잘 되고 촉촉함
보통 흡수 잘 되는 애들은 건조할 수가 있는데 별로 안건조하고 좋음
샘플 받아서 써봤는데 샘플 다 비운건 이 라인이 처음 ㅠㅠ!
솔직히 피부결 개선을 중요시하는 사람으로서 눈에 보이진 않았는데 왠지 모르게 자꾸만 손이 간다....
내가 써본 로션 중엔 제일 좋았던듯~
(하지만 난 로션 안쓰니까.......... 로션이 필요하다고 느껴질 때 할인을 한다면 이거 살 것 같기도)",4
엄마가 써서 같이쓰는 제품인데 무난하고 촉촉함. 에멀젼 스킨이라는데 내가 느끼기에는 스킨쪽에 더 가까운거 같음.,3
겨울엔 건조한 피부때문에 촉촉한 스킨로션만 사용했는데 촉촉하게 사용하기 좋은제품이였다. 향도 꽃향이라서 무난하게 사용하기좋음,4
엄청 좋은건 아니지만 단점도 딱히 없는 무난템,4
무난하게 바를수 있고 촉촉함!,3
얼굴에 바르면 촉촉하면서 말캉말캉? 부드러움을 넘어서 말캉말캉한 얼굴이 됩니다!!!! 써보세요!!!!!,4
그냥 무난 재구매안함,4
밀듯이 바르고 계속 두드려주면 번쩍번쩍 광나기 시작하는데 그게 얼굴이 너무 편하고 트러블도 없다 진짜 재구매의사 낭낭ㄹ하고요 홈쇼핑으로 네세트 쟁일까 생각중 유수분 밸런스 스킨이랑 같이쓰면 완벽해진다,4
"여행용으로 써봤는데 ...
혹시 피부 뒤집어지면 어쩌나 했었는데 괜찮았음 !
두드리면서 흡수 시키면 촉촉해지고 속광나는거 같음.
근데 향이 맘에 안들어 뭔가 ",3
겨울에 따로크림안발라도될정도로 촉촉한제품. 향도좋음. 그치만 정착하진않을거임..,4
무난하게 쓰기좋은데 바꾸고나서 좋은제품이라는걸 더 알게해준 제품..,4
"하 그냥 무난한 줄 알았는데...
그래서 얼굴에 한 달동안 계속 좁쌀/화농성 올라올때 왜 그런지 전혀 알질 못해서 이놈 끄집어내는데까지 오래걸렸네요.
얘 끊고 전에 쓰던 로션으로 다시 돌아가니까 화농성/좁쌀 더 안 생기고 들어가더라고요 ㅎ 붉은기도 진정되고..... 이 나쁜.......",1
"로션이 좀 무거운편이라 지성이시라면 좀더 고민을 해보시는게 좋을것같아요 겨울이라면 괜찮겠지만 여름되면 힘들지 않을까싶네요 유분기도 많은편이구요 전 이 로션을 다쓰면 로션을 안쓰는것도 고민해보려구요.. 로션자체는 괜찮아요 좁쌀,뾰루지 이런것도 안나구요",3
그렇게 무겁지도 않고 그렇다고 건조하지도 않고 딱 좋음! 향도 무난무난 하고 나는 수분 부족 지성이라서 스킨바르고 수분크림 바른 위에 수분감 안날아가고 유분감 좀 주기위해 한번만 펌핑해서 발라서 그런지 유통기한 꽉채워서 꽤 오래쓰는중!!,4
엄마꺼 훔쳐서 썼는데 모든 피부타입이 쓸 수 있어서 좋은 듯,4
이거 언니가 안쓴다고 툭 던져준건데 무난무난함,3
"아이오페 피부진단받고 샘플로 받아 사용했는데 그냥 좋은것도 나쁜것도 없는 무난템 
굳이 이가격주고 살 이유가없었다",3
이전에쓰던 스킨로션들은 쓰면서 별 좋은점을 못느꼇는데 이제품또한그랬다 하지만 다른걸써보니 피부결이 다르더라 이거 스킨로션쓰면 피부가 보들보들함 자꾸만지고픔ㅋㅋ 너무 무겁지도 가볍지도않고 적당한 유수분인듯,5
수퍼바이탈만 하지는 못하지만 얘도 좋은듯,4
그냥 딱 중간 좋은지도 나쁜지도 그래서 그냥 본품은 딱히 살 마음이 안생긴다,3
에멀젼인데 유분기도 너무 많고 무거운 느낌,3
"샘플로 받아서 가끔 사용하지만 화장품 화장품한 향과 약간의 끈적임?이 느껴지는 사용감에도 매우 촉촉하진 않아요
걍 무난템인 것 같아요",3
화장하기전에 기초제품으로 사용하는데 막 촉촉하다는 느낌은 안들었구요 그냥저냥 괜찮게 바를만한 로션이였어요!,3
저에 아이오페 입문을 도와준 친구에요 ㅋㅋㅋㅋ 그냥 정말 무난하고 별탈없고 여드름이 정말많던 제 피부에두 별 탈없이 잘붙어서 살아남아 주었어요! 소셜커머스 보니까 가격도 꽤 저렴하게 판매해서 홈쇼핑에서 구매하지말구 거기서 구매해야겠어용,4
진짜 무난무난한 로션이에요. 적당한 수분감과 유분감!,4
이 라인에 있는 아이들은 다 추천하지만 개인적으로 스킨이랑 로션을 사는 것을 강추! 스킨만으로는 부족하다고 느껴지는 건조한 날에는 스킨+로션으로 보습 탄탄하게 해주면 걱정없음. 아 듬뿍 바르고 잔 다음 날에도 트러블이 나지 않았음!ㅎㅎㅎ,5
스킨은좋은데 로션은 복합성인 나한테는 너무유분기가 심해서 스킨만쓰고 얼마쓰지도않고있네요,2
"스킨과 세트로 한통 다 비움!
너 역시 한 병을 다 쓸만큼 괜찮았으나 인생템은 아니기에 난 떠난다.
잘지내. 간혹가다 생각나면 다시 찾아올게",3
옛날엔 홈쇼핑서 함께 구매해서 썼지만 요즘엔 특별히 따로도 겟하는 제품! 안바르면 아쉽고 바르면 좋은 유분기를 잡아주는 아이입니당ㅋㅋ,3
"막 뭐가 와 좋다 할게 생각나진 않지만
뭐가 안좋다 하는것도 생각나지 않은 제품
무난하게 계속쓰기 괜춘해요",4
이것보다 같은라인스킨이더좋음!!,3
촉촉하고 무난하네요!,3
나쁘지않아요..알콜향이조큼나서 타사제품으로 바꾸긴했는데 1년동안 쓰면서 트러블없이 썼어용,4
딱히 쓰면서 나쁘다고 느낀점 없고 로션으로 쓰기 좋아요,4
전이게너무좋앗어요,5
"직원추천받아 샀는데 때처럼 밀리고 피부에서 겉도는 느낌이에요.. 
향도 역해요 이거 산거 넘 아까움.. 
트러블개선에도 딱히 효과는 없는듯",1
"샘플로 사용해봤는데 약하게 소독약 냄새나지만
피부는 진짜 진정,소독되는 느킴이예요
트러블도 좋아졌어요",4
트러블용은 쓰면 건조한데 이거는 촉촉했다,5
"딱히 트러블 있어서 쓰게된건 아니었는데
성분이 완전 순한 타입도 아니더라구요ㅠ
민감하신분들 주의하세요ㅠ",3
아이오페 트러블 수딩 토너와 함께 썼는데 너무 좋았어요! 적당히 유분기 있고 적당히 촉촉해서 저처럼 유수분 밸런스 안맞아서 트러블 생기는 수부지 분들에게 잘 맞으실 것 같아요! 개인적으로 잘 쓰고 있어요!,5
말 그대로 쏘쏘였어요 더 나빠지지 않도록 유지는 시켜주는데 진정효과는 딱히.. 추천 받아서 사용했는데 나쁘지 않아서 끝까지 사용했지... 저는 큰 효과는 모르겠어요,2
"건성이던 피부가 지성타입으로 변하면서 뒤집히고, 좁쌀이 너무 심하게 나서 스트레스 받던 차에 트러블라인이라길래 구매했어요. 가격이 저렴해서 그렇게 큰 기대는 안했지만 역시나 트러블에 딱히 효과가 있는지는 모르겠네용ㅠㅠ 그래도 토너랑 마찬가지로 유분기 적고 수분감만 있어서 지성인 분들 기초로 사용하기에는 괜찮은 것 같아요. 그치만 트러블에 효과는 없다고 느껴서 재구매는 안할 것 같네요ㅜㅠ",3
"트러블 관리용으로 스킨과 함께 사용하고 있는데 몇년째 못 떠나고 있어요
산뜻하고 약간 건조한 감이 없지않아 있지만 더 좋은 제품을 못찾고 있네요!
재구매 의사 100%입니다!",4
"뒤집어졌을때 구매했는데
나 지금 꿀피부임
회사 경비아저씨가 마주칠때마다 감탄하는 피부됨",4
"아이오페 트러블라인 쓰고 여드름 완전 좋아졌어요
완전 기름 많이올라오는 피부였는데 딱!! 알맞게 기름올라오는 피부로 바뀌었어요
유수분 밸런스 딱 맞춰주는느낌..!!!
가격만 착하면 평생쓸텐데..ㅠㅠ",5
그냥 그랬어용 트러블이 심해지지도 좋아지지도 않음,3
여드름 많이 났을 때 썼었는데 민감성 피부에 최고에요,4
"하도 여드름이 올라오던 시절 한통다비운 로션입니다
뭐하나만 기초바꾸거나 베이스 바꾸면 바로 여드름나고 얼굴따가운 핵민감성피부라 조마조마하면서 거금들여샀는데 그냥무난무난했음
트러블클리닉 말들으면 여드름이 로션만바르면 뿅사라질거같지만 그런효과는 피부과를 가야하는것이고 이로션은 그냥 순한로션..
제 핵민감피부에도 아무 탈없었고 여드름은 나지않았어요 이거바르고 트러블이 가라앉네!이건 못느낌.
재구매는 안할래요 넘나리비쌈 세일도자주안함",3
"전형적인 로션
트러블용이라는데
딱히 효과는 모르겠음
아리따움이 동네에 있어서
자주가는데
거기 직원분이 이걸로 샘플을 많이 주십니당(감사감사)
그래서 여행용으로 잘 쓰고 있습니다",3
가벼운 느낌의 로션임 트러블 라인 스킨이랑 로션이랑 구매했는데 딱 수분만 주는 느낌으로 가볍게 발랐음 여름에는 기름지지 않고 좋은데 가을 겨울에는 건조해서 수분크림 하나 더 발라줬어야 했음 다른 트러블이 나는 거를 방지해줘서 잘 썼던 제품임,4
"지금 생각해보면 꾸준히 사용하면
트러블엔 가장 좋았던 제품인듯! 
그런데 겨울에 스킨로션 쓰기에는 조금 건조한감이
있슴미당!",4
"이거 예전에 하늘색 병에 들어있던 그 트러블라인이 맞나여
맞다면 병이 몰라보게 달라졌네요
무튼 화장품에 대해 잘 몰랐던 고딩~대딩 시절에 암꺼나 막 발라대서 볼에 트러블 폭탄 맞았던 때가 있었음. 그때 어떤 계기였는진 기억안나지만 우연히 아이오페 트러블라인을 써보게 됨. 눈에띄게 효과를 보게됐고 그렇게 한 네통정도는 쓴듯.
트러블이 좋아지는게 보이고 신뢰도가 무한 상승해서 돈없어도 이 라인만 고집해서 사서 썼었음. 학생이었을때 쓰기엔 에멀젼까지 사면 가격대가 좀 있었음
지금은 피부가 안정화 되서 쓰진 않지만 트러블 있는 분들께 추천드림",4
여드름은 조금 개선되긴 하였지만 삼만칠천원...내 기준에선 넘 비쌌음 재구매할 생각은 없지만 주면 쓸것 같은 제품??,3
"써봤던 로션중에 흡수가 제일 안되요... 피부겉에 떠도는느낌ㅠ
효과를 원하시면 스킨이 효과 더 좋아요~",2
"냄새도 괜찮고 제형이 가볍워요 
근데 여름엔 흡수가 조금 느린느낌이에요",3
묽고 가벼워서 지성피부에 좋을 것 같아요 리뉴얼되서 달라졌는지는 모르겠어요 ㅠㅠ 제가 여드름 많이 나는 피부인데 여드름 피부 로션들 중에는 이게 가격대비 젤 무난한갓같아요!,4
"스킨보다는 덜빨리써서 5통쯤 썼어요 ㅋㅋ
트러블때문에 스킨로션 유목민이었는데 여기에 정착했어요. 
4계절내내 유수분 딱 맞춰주니 이것만한게 없네요. 
리뉴얼되면서 가격 내려갔는데, 향은 좀 덜해졌고 촉촉함은 그대로에요",5
트러블 한창날때  이 라인으로 토너랑 같이썼는데. 트러블 다죽음 .,4
처음사용햇을때 효과가없어서 뭐지햇는데 좀 두달사용하니까 전 변화가좀잇엇어요 뾰루지같은것들에 바르고 자면 좀 가라앉앗어요 괜찮아요,3
트러블 개선 해준다며..색소침착도 여드름도 어느 것 하나 잡지 못한 제품. 심지어 발랐을 때 답답한 느낌도 많이 들었다. 한 통 다 쓸때까지 조금도 좋아질 기미를 안보임 여드름 때문에 고민이신 분들 한율 쑥 라인을 쓰세요ㅠ,2
트러블에 효과가 있는지는 잘 모르겠고 걍 쓸만함,3
토너와 마찬가지로 트러블에 효과가 있는지는 모르겠고 그냥 쓰는중...,4
"트러블 에멀젼 치고는 딱히 좋고 나쁜것
못 느끼고 한통 다씀",3
처음엔 효과가 있는 듯 했으나 지금은 그냥저냥 쓰고 있는 에멀젼,3
"바르고 나서 겉도는 느낌이 있다 그래서 속을 채워주지 못하는 듯해 한번 쓰고  그 이후로는 안씀 트러블 낮추는
지도 잘 모르겠음",2
유분기가 적지 않게 잇었고 바르면 살짝 번들한정도? 여드름에.효과는 잘 모르겠다 미미하게 있울 수 도 있었겠지만.. 눈에 띄게 효과를 보진 못했다 근데 뭐 여드름이 심해지거나 자극이.있다거나 향이 별로라거나 그런 단점없이 무난무난 하게 쓸수 있는것같다,3
"같은라인 수딩토너랑 같이 썼었는데 로션이... 밀리고 건조해서 조금만 더 바르면 때가 밀려 나왔었다. 내 피부가 잘못인지 모르겠지만,,,,",2
"아 걍 짱좋음 진짜

겁내 촉촉함",5
"유수분 밸런스도 딱 적당하고 피부결 부들부들해짐! 여드름 진정, 억제 효과 있었어요 다만 가격이 비쌈 돈벌면 살게요 안녕 아이오페......",4
토너는 쓰게된다쳐도 에멀젼은 진짜 손이 안가게 된다능 ㅠㅠ 발라놓고 잇다보면 기름져서.. ㅠㅠ 너무시러요,3
가볍고 촉촉한데 바르고나면 보송한 느낌이라  가볍게쓰기 좋은거같아요!!!!,4
이거 정말 여러통째 비우고 있는데요 타사의 트러블 제품과 다르게 촉촉한 게 강점인 로션입니다. 건성이어서 좁쌀여드름이 조금씩 올라오는 저에게 딱 맞는 제품입니다!!,5
진짜순하고 이거바르면서 크게 뭐난적 별로 없었음 !! 지금도 만족스럽게 쓰고있습니닿ㅎㅎ,4
토너랑 같이썼는데 바로 전 리뷰에서도 언급했지만 가성비 좋은 물건은 아니다. 그치만 자극적이진 않아서 여드름이 심해지진 않음,3
처음에는 꾸덕? 해서 유분이 많은줄 알았는데 흡수 금방되더라구용ㅎㅎㅎ 냄새가 약간 떨떠름했는데 그래도 좋음!,4
"에멀전은 좋은지 모르겟어요 마지막에 에멀전은 바르는데 
화장하면 화장이 밀린다고 해야되나? 이거 바르고 화장은 못해요 그래서 에멀젼은 저녁에만 바르는데 그부분은 정말 안좋네여",3
트러블에 무난하게 좋고 냄새도 시원한 티트리냄새가 나서 깨끗해지는 느낌이에여~~~,5
스킨과 세트로 사용했는데 트러블라인임에도 불구하고 가끔 뒤집힌적이 ㅠㅠ,2
"트러블 라인치고는 보습력이 나쁘진 않지만 트러블엔 효과가 없다.
유분기가 좀 많아서 번들러리니 겨울에나 쓰기 좋을듯..
이 라인은 토너만 좋은듯 하고 나머진 다 별로 ㅠㅠ",3
토너랑같이썻는데 벗겨지고 별루엿어여,2
나쁘지않았지만 좋지도 않았던 로션 트러블에는 별 소용없던것같아요 너무 무겁지않아서 좋았지만 수분력은 그닥..,3
로션일 뿐인데 이거 쓰고 2주 후에 트러블이 잠잠해지고 피부가 매끈해지는 것을 경험...,4
여드름 효과는 나에게 없는거같음 바르고나면 깔끔해서 기분이 좋긴함,2
"정말 트러블이 진정됨...!
얼굴에 뭐 올라올때마다 발랐는데
담날에 피부 좋아졌음
사용감도 산뜻하고
냄새도 싸한게 시원해서 맘에듬

원래 트러블라인은 보습이 0에 수렴하던데
이건 보습제가 따로 필요없을정도로 어느정도 촉촉해서 좋음(여름 한정)",5
토너랑 같이 사용 중인데 시원한 느낌? 외엔 딱히 효과는 ..,3
토너 에멀전 에센스 세개 다 구매했는데 이건 손도 안대오 .. 처음에 얼굴에 올리고 깜짝놀랐어요 기름같아서 ㅠ_ㅠ 아리따움 언니 말로는 성인여드름을 위한 제품이라 보습까지 잡아주는거라고 하셨는데 왠지 트러블을 더 나게 하는 것같아서 첫날 이후로 사용중지,2
제가 이 제품 처음 썼을 때가 여름이어서 그때 샘플로 받은거라 여행가서 걍 썼는데 딱 닿자마자 너므 무거운 느낌이길래 에이 이거 여름엔 절대 못쓰겠다 했어요 근데 바를때 느낌은 넘 답답하고 무겁고 유분기 넘 많은 거 같고 그래서 개별로였는데 흡수되고 나서는 진짜 짱이예요 보습력..제가 기초라인 답답한 느낌 드는 거 굉장히 싫어하고 못 참아하는 편인데 이건 걍 참고 씁니다..벌써 세 통째 예오 여름에도 답답해도 걍 참고 썼어욬ㅋㅋㅋㅋㅋ양 조절을 해가며..ㅎ 그만큼 저한테는 넘 잘 맞는 제품이었고 이거 쓴 후로는 속건조나 당김같은 것도 거의 못 느껴보고 흡수된 뒤에 베이스도 거의 다 잘 먹는 느낌이라 당분간은 계속 정착해서 쓸것같아요..!,5
스킨도 덮는 느낌이 나는데 이건 피부를 더 답답하게 덮고 있다는 느낌이 들게해서 저한테는 좀 별로 였습니다 ㅠㅠ 누가 선물해주지 않는 한 전 안쓸거 같아요 ㅠㅠ,2
여름에 쓰기엔 너무 미끌거리고 무겁네요.. 겨울에는 그래도 쓸 만 했는데 여름에는 손이 잘 안 갑니다ㅜㅜ.... 피부에 발랐을 때 쫙 흡수되는 게 아니라 약간 겉도는 느낌이 있어요. 미끌미끌해서 지금 계절엔 좀 답답한 느낌입니다. 일단 화장대에 넣어뒀다가 겨울 되면 다시 꺼내쓰려구요...!,3
"보습력은 좋은데
너무 미끈거리고 여름에 쓰긴 힘드네요ㅠㅠ",3
"ㅋㅋ.. 진짜 제품이나 이름만 보면 굉장히
촉촉하고 산뜻할거 같은데 ㅠㅠㅠㅠ아니에요
전혀 ㅠㅠㅠㅠㅠ 유분땜에 기름기 장난 아니고
특유의 그 미끄덩거리는 마무리감 ㅠㅠㅠㅠㅠ
저한테는 진짜 별로 였어요 
건성피부분들도 메이크업전엔 힘들거 같은..",2
"스킨과 같이 사용했을때
오히려 스킨보다 흡수력이 더 좋았고
더 건조한 느낌이 있는 것 같아요.
끈적임도 없고 깔끔하게 마무리되어서 좋지만
스킨과 로션 두가지만 사용하기에는
저한테 살짝 건조한 것 같아요!",3
그냥 그냥 그랬어요 좋지도 않고 나쁘지도 않고 그냥 로션,3
"너무 별로 진짜 별로...
이니스프리 제품을 너무 좋아하지만 이 제품은 나한테 너무 안맞음 뭐가 나거나 올라오진 않지만 여름엔 너무 기름지고 겨울엔 수분없이 동뜨는 느낌이고 펌핑형식이거나 튜브형식이 아니라서 좀 입구부분이 비위생적으로 됨. 작년초에 샀는데 아직 반이상 남아있음. 내 친구들 중에는 잘 맞는다는 사람이 있기는 하지만 기본 수분+조금의유분을 원하는 사람이라면 안맞을 것 같고, 겨울철에는 아주 조금씩 여러번 레이어링해야 쓸만했음.",1
정말 좋아요! 답답한감이 약간 있긴한데 건성이라서 그런지 이 느낌이 좋았습니다. 피부 건조해서 화장안먹을때 이걸로 바꾸니까 바로 효과있네요~,4
이 라인 스킨은 가벼운 편이라서 로션도 그렇겠지 ? 라고 생각했지만 전혀. 로션은 굉장히 무거운 편임 용기가 양조절 하기 조금 어렵긴 한데 쓰다보면 적응됨 스킨만 하면 좀 건조할 수 있으나 로션이 그 건조함을 잡아주기 때문에 밸런스가 괜찮은 편이라고 생각. 하지만 아무리 건조한 수부지라도 여름엔 기름질 수 있으니 주의 !! 여름에 너무 기름져서 다른 거로 갈아타보려 했지만 이상하게 다시 돌아오게됨 그냥 무난한게 장점인 제품,3
생각했던 것보단 가볍진 않고 보습력이 좋아서 겨울철에 주로 쓰고 있는데 바르고나면 피부가 전혀 당기지 않아서 좋아요,4
건성이라 저한텐 딱좋았고 재구매로 잘쓰고있어요,5
조그만한 샘플통에 있길래 건조할때 발랐는데 나쁘지도않고 촉촉했어요 근데 냄새가 별로라서 .. 근데 저는 얼굴이아니라 몸에다가 발랐습니당,3
음... 한번쓰고 두번다시는 안쓰게 만드는 신기한 제품.. 이 기름진걸 얼굴에 다시는 올리고싶지 않다...,1
스킨과 로션 함께 사용하고 있는데 단점은 없는 것 같고 무난무난하게 사용할 만 해요,3
스킨이랑 새라서 그냥 쓰는 둘다 엄청 좋드라는 생각은 안들지만 보습도 좋고 다 전체적으로 좋음,3
제품의 좋은점은 잘 모르겠고 냄새가 좋았습니더,3
저는 이 라인의 스킨과 함께 로션을 사용하고 있는데 건조한 부분에 무거운 느낌 없이 사용하면 좋은 제품이고 흡수도 잘되니 아주 만족하며 사용하고 있습니다.,5
"다른분들 다 별로라 하시는데 저는 너무 좋았어요
물처럼 흐르는 제형이고 확실히 유분기가 많지만
겨울에 바르기에는 딱 좋은 제품인것 같아요
화장하기 전에 전 이거 꼭 바릅니다",5
"너무 구려서 어디부터 말해야할지 모르겠다

스킨도 구린데 애보단 덜 해서 그나마 낫다,
제형은 대충 기울이기만 해도 나온다, 좀 무르다

문제는 이 스킨로션 모두 너무 유분기가 많아서 흡수가 정말 안된다, 피부에서 따로따로 놀아서 결국에는 피부에 번들거리면서 오일성분만 남음

향은 좋지만 이 라인 재구매는 절 대 없을 것임 이니스프리에서 산 스킨케어 라인 중 가장 구린 라인이였다",1
